[
  {
    "schema_version": "1.0.0",
    "source_id": "src:cat123",
    "title": "CAT-123 · Manual Catholix Operating Protocol",
    "publisher_or_authority": "Alan W. Gallagher / Catholix",
    "source_type": "CONTROLLED_DRIVE_RECORD",
    "authority_class": "GOVERNING_INTERNAL",
    "jurisdiction": "Aldernia internal / UK real-world controls where applicable",
    "domain": "Catholix / operational governance",
    "canonical_locator": "drive:14rxhnw7MK5LLnj8QbrokDAeKBV_PlOg4ffuCUsV7ghI",
    "version_or_revision": "ANLCKQn5niVEDZXow_Fd1B-EURFKHFYAQ9c6jTSk8n2VAoEoQtMxQ6eFeJxYe1br3cWfOupEXBC1w5e63hAggU6Tr0P2u-90ZcZyCsqke_s",
    "publication_date": null,
    "retrieved_at": "2026-09-21T05:21:00+01:00",
    "last_verified_at": "2026-09-21T05:21:00+01:00",
    "freshness_class": "EVENT_DRIVEN",
    "refresh_trigger": "Refresh on material source/revision/release/capability change or point of consequential use.",
    "scope_supported": [
      "Catholix / operational governance"
    ],
    "claims_supported": [
      "Authority order, source-of-truth and deployment verification rules."
    ],
    "limitations": [
      "Projection pointer only; consult the canonical source at point of consequential use."
    ],
    "supersedes": [],
    "superseded_by": null,
    "copyright_or_reuse_note": "Reference/provenance metadata only; source rights remain with the source owner.",
    "owning_specialist": "House of Catholic / Catholix governance",
    "status": "CURRENT",
    "projection_authoritative": false
  },
  {
    "schema_version": "1.0.0",
    "source_id": "src:palace-settlement",
    "title": "The Royal Palace — Founding Constitutional & Operating Settlement 01",
    "publisher_or_authority": "The Royal Palace",
    "source_type": "CONTROLLED_DRIVE_RECORD",
    "authority_class": "GOVERNING_INTERNAL",
    "jurisdiction": "Aldernia internal / UK real-world controls where applicable",
    "domain": "Aldernia constitutional governance",
    "canonical_locator": "drive:17urYyFWqc1ezykTpp8LHjuGqywBXmmr_O0hs_89QXGE",
    "version_or_revision": "ANLCKQlx7F3h7wCa95D93vYLZT0kHJLhJ8fWbTPNrG7o7aV_b4crwOn-mUF-gilQDkz_HsxbSNJ8butWG7urCnIXrjV7xHdZD9rzdtJmuiE",
    "publication_date": null,
    "retrieved_at": "2026-09-21T05:21:00+01:00",
    "last_verified_at": "2026-09-21T05:21:00+01:00",
    "freshness_class": "EVENT_DRIVEN",
    "refresh_trigger": "Refresh on material source/revision/release/capability change or point of consequential use.",
    "scope_supported": [
      "Aldernia constitutional governance"
    ],
    "claims_supported": [
      "Reset, constitutional boundaries and Crown authority."
    ],
    "limitations": [
      "Projection pointer only; consult the canonical source at point of consequential use."
    ],
    "supersedes": [],
    "superseded_by": null,
    "copyright_or_reuse_note": "Reference/provenance metadata only; source rights remain with the source owner.",
    "owning_specialist": "The Royal Palace",
    "status": "CURRENT",
    "projection_authoritative": false
  },
  {
    "schema_version": "1.0.0",
    "source_id": "src:public-world-blueprint",
    "title": "The Royal Palace — Aldernia Public World Blueprint 01",
    "publisher_or_authority": "The Royal Palace",
    "source_type": "CONTROLLED_DRIVE_RECORD",
    "authority_class": "GOVERNING_INTERNAL",
    "jurisdiction": "Aldernia internal / UK real-world controls where applicable",
    "domain": "Aldernia public world",
    "canonical_locator": "drive:1rpI4JSdxbrcIyr84Ezg-HX7qHdS5xi0oSYsO02Bwct8",
    "version_or_revision": "ANLCKQl4Dj_EBH-TH236gvH0Po45FM0YvSLhheUdjLlW-k2Dlhb6wqRT2t4fzQIFKnXooOZ_9grcmPqYHoRvPOA7OwxRvqEXF7a6ZQwalkM",
    "publication_date": null,
    "retrieved_at": "2026-09-21T05:21:00+01:00",
    "last_verified_at": "2026-09-21T05:21:00+01:00",
    "freshness_class": "EVENT_DRIVEN",
    "refresh_trigger": "Refresh on material source/revision/release/capability change or point of consequential use.",
    "scope_supported": [
      "Aldernia public world"
    ],
    "claims_supported": [
      "Current public-world canon and release record."
    ],
    "limitations": [
      "Projection pointer only; consult the canonical source at point of consequential use."
    ],
    "supersedes": [],
    "superseded_by": null,
    "copyright_or_reuse_note": "Reference/provenance metadata only; source rights remain with the source owner.",
    "owning_specialist": "The Royal Palace / House of Josie for editorial ownership",
    "status": "CURRENT",
    "projection_authoritative": false
  },
  {
    "schema_version": "1.0.0",
    "source_id": "src:engine-manifest",
    "title": "Dynasty Engine Definition Schema & Current Engine Manifest 01",
    "publisher_or_authority": "Computer of Series / House of Series",
    "source_type": "CONTROLLED_DRIVE_RECORD",
    "authority_class": "GOVERNING_INTERNAL",
    "jurisdiction": "Aldernia internal / UK real-world controls where applicable",
    "domain": "Engine capability and routing",
    "canonical_locator": "drive:1NumS4_cKvgJLQfUIG45Nug7clbv2zuxU2EZ9bvSJdXQ",
    "version_or_revision": "ANLCKQmBvfI8TYtULHz7lDrklZPJJvxVzCkX5ZT84UyFewVKUOOVRqfcztIkdPEzHh70N20VlMB6IiGweR9yXtGSraplX0T1WM5JdOGFzws",
    "publication_date": null,
    "retrieved_at": "2026-09-21T05:21:00+01:00",
    "last_verified_at": "2026-09-21T05:21:00+01:00",
    "freshness_class": "EVENT_DRIVEN",
    "refresh_trigger": "Refresh on material source/revision/release/capability change or point of consequential use.",
    "scope_supported": [
      "Engine capability and routing"
    ],
    "claims_supported": [
      "Current engine definitions including COS-BUS, selector bindings, Seamus, Moira and Josie pipeline."
    ],
    "limitations": [
      "Projection pointer only; consult the canonical source at point of consequential use."
    ],
    "supersedes": [],
    "superseded_by": null,
    "copyright_or_reuse_note": "Reference/provenance metadata only; source rights remain with the source owner.",
    "owning_specialist": "Computer of Series",
    "status": "CURRENT",
    "projection_authoritative": false
  },
  {
    "schema_version": "1.0.0",
    "source_id": "src:series-control",
    "title": "House of Series — AI, Resource, Execution & Assurance Control Register 01",
    "publisher_or_authority": "House of Series",
    "source_type": "CONTROLLED_DRIVE_RECORD",
    "authority_class": "GOVERNING_INTERNAL",
    "jurisdiction": "Aldernia internal / UK real-world controls where applicable",
    "domain": "AI/runtime/resource assurance",
    "canonical_locator": "drive:1f7CvUz3abW0WuuPkoDRdwnLDs4Bgd-K0yfcNszQ9Crk",
    "version_or_revision": "ANLCKQk520mEeUGF4Vwq-D49VwgMck2e5l3Nm0BgiZTuXsO85tzjBNCRucV9GID1hrAWA-rNkL0dP8l2zxLERvJ1hn2S5l3wg2pYg-1DHsw",
    "publication_date": null,
    "retrieved_at": "2026-09-21T05:21:00+01:00",
    "last_verified_at": "2026-09-21T05:21:00+01:00",
    "freshness_class": "EVENT_DRIVEN",
    "refresh_trigger": "Refresh on material source/revision/release/capability change or point of consequential use.",
    "scope_supported": [
      "AI/runtime/resource assurance"
    ],
    "claims_supported": [
      "Common AI, resource, execution, assurance, CAPA, resilience and heartbeat controls."
    ],
    "limitations": [
      "Projection pointer only; consult the canonical source at point of consequential use."
    ],
    "supersedes": [],
    "superseded_by": null,
    "copyright_or_reuse_note": "Reference/provenance metadata only; source rights remain with the source owner.",
    "owning_specialist": "House of Series",
    "status": "CURRENT",
    "projection_authoritative": false
  },
  {
    "schema_version": "1.0.0",
    "source_id": "src:capability-registry",
    "title": "House of Series — Institutional Capability Registry & Exchange 01",
    "publisher_or_authority": "House of Series",
    "source_type": "CONTROLLED_DRIVE_RECORD",
    "authority_class": "GOVERNING_INTERNAL",
    "jurisdiction": "Aldernia internal / UK real-world controls where applicable",
    "domain": "Capability discovery and exchange",
    "canonical_locator": "drive:1f9ehuX67WRwYMLK0JD7s1q-NEN9BGqdzNC3kfxyLl7s",
    "version_or_revision": "ANLCKQlBNqOAh0x6mQRPbK5MaXBgDDfNJ9_6uZrBJkeIW371rNiVWV_YOnSqtG69ch1XTOTewuZpmA680_e1SmGASpWqmxDE7ByhhR8TpHQ",
    "publication_date": null,
    "retrieved_at": "2026-09-21T05:21:00+01:00",
    "last_verified_at": "2026-09-21T05:21:00+01:00",
    "freshness_class": "EVENT_DRIVEN",
    "refresh_trigger": "Refresh on material source/revision/release/capability change or point of consequential use.",
    "scope_supported": [
      "Capability discovery and exchange"
    ],
    "claims_supported": [
      "Evidenced capability discovery without transfer of ownership."
    ],
    "limitations": [
      "Projection pointer only; consult the canonical source at point of consequential use."
    ],
    "supersedes": [],
    "superseded_by": null,
    "copyright_or_reuse_note": "Reference/provenance metadata only; source rights remain with the source owner.",
    "owning_specialist": "House of Series",
    "status": "CURRENT",
    "projection_authoritative": false
  },
  {
    "schema_version": "1.0.0",
    "source_id": "src:josie-first-read",
    "title": "House of Josie — Media — FIRST READ, Founding Constitution & Bootstrap Control 01",
    "publisher_or_authority": "House of Josie — Media",
    "source_type": "CONTROLLED_DRIVE_RECORD",
    "authority_class": "SPECIALIST_INTERNAL",
    "jurisdiction": "Aldernia internal / UK real-world controls where applicable",
    "domain": "Journalism/editorial/public accountability",
    "canonical_locator": "drive:1ulQ0QDZLveGRvT_zJt5eUXDXgdIKntnwEliNK98zAc0",
    "version_or_revision": "ANLCKQkDpaQqJ-7VxPi3gRyUgaInK2VDfEYRtmj_6JU8y6NuXXT4vU2pKIvc_MknVb2ildr5eHsRkUnIztfAd4iYrTEIPJYviT0EaLHl8qg",
    "publication_date": null,
    "retrieved_at": "2026-09-21T05:21:00+01:00",
    "last_verified_at": "2026-09-21T05:21:00+01:00",